{
  "id": "KB-2026-0012-claims-ingestion-n8n-supabase-monday-operating-strategy",
  "title": "Claims Ingestion Operating Strategy From n8n Parser To Supabase And Monday",
  "domain": "automations",
  "kind": "blueprint",
  "status": "active",
  "confidence": "high",
  "created_at": "2026-05-18",
  "created_by": "codex",
  "last_verified": "2026-05-18",
  "last_verified_by": "codex",
  "human_approved_by": "Dr. Seidel",
  "tags": [
    "n8n",
    "supabase",
    "monday-com",
    "claims-ingestion",
    "claims-reconciliation",
    "service-line-audit",
    "control-totals",
    "transient-cache",
    "workflow-design",
    "source-verification",
    "schema-validation",
    "idempotency"
  ],
  "summary": "End-to-end operating strategy for parsing paid, denied, pending, all-claim, and payment-detail claim sources through n8n adapters, staging only bounded transient data, uploading verified audit/final rows into Supabase/Postgres, and synchronizing Monday as the operational output surface after dry-run and re-read gates.",
  "related": [
    "KB-2026-0001-n8n-datatable-idempotent-upsert-pdf-parser",
    "KB-2026-0003-universal-claims-ingestion-transient-dedupe",
    "KB-2026-0006-supabase-authoritative-monday-sync",
    "KB-2026-0007-denied-claims-refresh-cache-rebuild-strategy"
  ],
  "supersedes": null,
  "superseded_by": null,
  "challenged_by": [],
  "deprecated_reason": null
}
