{
  "id": "KB-2026-0003-universal-claims-ingestion-transient-dedupe",
  "title": "Universal Claims Ingestion With Transient Cache And Durable Dedupe",
  "domain": "automations",
  "kind": "blueprint",
  "status": "proposed",
  "confidence": "low",
  "created_at": "2026-05-01",
  "created_by": "codex",
  "last_verified": "2026-05-11",
  "last_verified_by": "claude-opus-4-7",
  "human_approved_by": null,
  "tags": [
    "n8n",
    "supabase",
    "claims-ingestion",
    "deduplication",
    "transient-cache",
    "control-totals"
  ],
  "summary": "Reusable blueprint for multi-source claims ingestion using n8n orchestration, transient staging, durable Supabase dedupe, service-line audit, and control-total validation.",
  "related": [
    "KB-2026-0001-n8n-datatable-idempotent-upsert-pdf-parser"
  ],
  "supersedes": null,
  "superseded_by": null,
  "challenged_by": [],
  "deprecated_reason": null
}
