{
  "id": "KB-2026-0007-denied-claims-refresh-cache-rebuild-strategy",
  "title": "Denied Claims Refresh With Supabase Authority, Monday Resolution, And Cache Rebuild",
  "domain": "automations",
  "kind": "blueprint",
  "status": "active",
  "confidence": "high",
  "created_at": "2026-05-15",
  "created_by": "codex",
  "last_verified": "2026-05-15",
  "last_verified_by": "codex",
  "human_approved_by": "Dr. Seidel",
  "tags": [
    "n8n",
    "monday-com",
    "supabase",
    "datatable",
    "transient-cache",
    "claims-reconciliation",
    "denials",
    "denial-management",
    "source-verification",
    "schema-validation",
    "workflow-design"
  ],
  "summary": "Verified strategy for refreshing denied claims from current report files: parse and scope official denial evidence, dry-run against Supabase and Monday, execute idempotent writes with backups and re-read verification, remove stale operational Supabase rows, mark absent Monday items resolved, and rebuild n8n Data Table caches by archiving the old cache and creating a fresh version when in-place refresh is not supported.",
  "related": [
    "KB-2026-0001-n8n-datatable-idempotent-upsert-pdf-parser",
    "KB-2026-0003-universal-claims-ingestion-transient-dedupe",
    "KB-2026-0005-multi-clinic-paid-claims-consolidation-pdf"
  ],
  "supersedes": null,
  "superseded_by": null,
  "challenged_by": [],
  "deprecated_reason": null
}
