{
  "id": "KB-2026-0008-monday-sync-bugs-and-acceleration-patterns",
  "title": "Mondayâ†”Supabase sync â€” bug catalog, label normalization, drain acceleration & DataTable migration design",
  "domain": "automations",
  "kind": "blueprint",
  "status": "proposed",
  "confidence": "high",
  "created_at": "2026-05-15",
  "created_by": "claude-opus-4-7",
  "last_verified": "2026-05-15",
  "last_verified_by": "claude-opus-4-7",
  "human_approved_by": null,
  "tags": [
    "n8n",
    "monday-com",
    "supabase",
    "postgres",
    "sync",
    "performance",
    "data-quality",
    "security",
    "configuration",
    "api-integration"
  ],
  "summary": "Concentrates 10 bugs discovered and fixed during the Supabaseâ†’Monday sync pipeline hardening (sessions 10-12, May 14-15 2026): wrong n8n port hardcoded in 4+ workflows, JWT credentials leaked in parameters, Monday dropdown/status label case-sensitivity, board_relation serializer missing, PostgREST max_rows silent truncation, parsed_claim_rows duplicate lines distorting aggregations, Monday bulk-mutation contagious failure from archived items, n8n DataTable size limit being instance-wide, and a 30x drain acceleration approach. Includes design for migrating `monday_board_cache_v2` DataTable to dedicated Postgres in Supabase with zero-downtime dual-write strategy.",
  "related": [
    "KB-2026-0006-supabase-authoritative-monday-sync",
    "KB-2026-0007-denied-claims-refresh-cache-rebuild-strategy"
  ],
  "supersedes": null,
  "superseded_by": null,
  "challenged_by": [],
  "deprecated_reason": null
}
