{
  "id": "KB-2026-0001-n8n-datatable-idempotent-upsert-pdf-parser",
  "title": "n8n DataTable Workflow Pattern With Idempotent Upsert And PDF Parser Architecture",
  "domain": "automations",
  "kind": "blueprint",
  "status": "active",
  "confidence": "high",
  "created_at": "2026-05-01",
  "created_by": "claude",
  "last_verified": "2026-05-11",
  "last_verified_by": "claude-opus-4-7",
  "human_approved_by": "Dr. Seidel",
  "tags": [
    "n8n",
    "datatable",
    "idempotency",
    "pdf-parsing",
    "workflow-design",
    "source-verification"
  ],
  "summary": "Reusable blueprint for n8n ingestion pipelines that parse vendor PDF reports into a normalized deduplicated cache, with verified DataTable node config, deterministic batch_id idempotency, parallel-branch parser shape, and coordinate-aware PDF extraction.",
  "related": [
    "KB-2026-0003-universal-claims-ingestion-transient-dedupe"
  ],
  "supersedes": null,
  "superseded_by": null,
  "challenged_by": [],
  "deprecated_reason": null
}
